{
  "schema_version": 1,
  "packet_id": "11111111-1111-4111-8111-111111111111",
  "session_id": "local-session-001",
  "seq": 42,
  "watch_timestamp": "2026-09-07T14:12:03.123Z",
  "kind": "telemetry",
  "payload": {
    "heart_rate_bpm": 134.0,
    "heart_rate_sample_age_ms": 680,
    "elapsed_s": 812,
    "distance_m": 1840.2,
    "speed_mps": 2.55,
    "location": {
      "lat": 10.7765,
      "lon": 106.7009,
      "horizontal_accuracy_m": 7.8,
      "age_ms": 2100
    },
    "motion_state": "running",
    "watch_battery": 0.72,
    "transport": {
      "phone_reachable": true
    }
  }
}

